{
  "$schema": "../src/build/course.schema.json",
  "site": {
    "project": "myofascial-movement",
    "name": "筋膜與動作整合",
    "url": "https://myofascial-movement.pages.dev",
    "locale": "zh-Hant",
    "ogLocale": "zh_TW",
    "brandIcon": "waves",
    "title": "筋膜與動作整合：從組織科學到活動度、負荷與恢復",
    "description": "不把筋膜神化，也不把筋膜忽略。九個章節、27 個單元，從筋膜解剖與疼痛科學，到自我放鬆、活動度、主動控制與漸進負荷。每個主張都拆成「觀察到的效果」與「已證實的機轉」兩層，附 PubMed 查證——包含那些和滾筒行銷話術相衝突的結果。",
    "ogDescription": "滾筒滾完覺得鬆，不等於沾黏被壓開。這門課把筋膜的每個常見說法拆成效果證據與機轉證據兩層，九章 27 個單元、上百支示範影片，每一條都附得起原始文獻。",
    "keywords": [
      "筋膜",
      "自我筋膜放鬆",
      "滾筒",
      "活動度",
      "動作控制",
      "伸展",
      "疼痛科學",
      "運動恢復"
    ],
    "audience": "會滾筒但不確定滾對沒有的運動者、想理解活動度訓練原理的教練、對筋膜說法半信半疑的人",
    "about": [
      "筋膜與結締組織",
      "自我筋膜放鬆",
      "活動度訓練",
      "動作控制",
      "疼痛科學"
    ],
    "learningResourceType": [
      "影片課程",
      "動作示範",
      "自我評估"
    ]
  },
  "hero": {
    "eyebrow": "實證自學課程",
    "heading": "不把筋膜神化，也不把筋膜忽略",
    "lede": "十三個章節、{units} 支影片，以 Myers 的十二條肌筋膜經線為主軸，涵蓋 {problems} 個實作主題。每一條線都照同一個順序講：<strong>這條線是什麼</strong>、<strong>它的解剖驗證到哪裡</strong>、<strong>這一區值得練的是什麼</strong>，最後才是跟練。驗證數字寫在每章開頭，不藏在展開區塊裡。"
  },
  "ui": {
    "searchPlaceholder": "搜尋單元、動作或部位…",
    "tabs": {
      "course": "課程內容",
      "player": "上課模式",
      "stance": "這門課的立場"
    },
    "progressLabel": "學習進度",
    "facetLabel": "依身體區域篩選",
    "assessmentLabel": "你要觀察什麼",
    "coachPracticeLabel": "教練怎麼做",
    "tightLabel": "常見主訴部位",
    "weakLabel": "需要一起練的動作能力",
    "lessonLabel": "主課",
    "drillEvidenceLabel": "這類介入的實證",
    "unitEvidenceLabel": "科學證據",
    "practicalLabel": "實務教學價值",
    "roleLabel": "內容角色",
    "creatorLabel": "作者背景",
    "coachTakeawayLabel": "教練實務重點",
    "claimBoundaryLabel": "課程保留",
    "safetyLabel": "安全界線",
    "subsLabel": "字幕",
    "subsManualLabel": "人工字幕",
    "subsAutoLabel": "自動字幕",
    "stats": [
      {
        "icon": "layers",
        "field": "lesson_units",
        "label": "個單元"
      },
      {
        "icon": "clock",
        "field": "duration",
        "label": "課程時長"
      },
      {
        "icon": "waves",
        "field": "drill_units",
        "label": "支示範影片"
      },
      {
        "icon": "activity",
        "field": "problem_units",
        "label": "個實作主題"
      },
      {
        "icon": "microscope",
        "field": "evidence_checked",
        "label": "題實證查核"
      }
    ],
    "unitTypes": {
      "practice": "實作主題",
      "concept": "觀念",
      "myth": "迷思查核",
      "program": "課表",
      "guide": "說明"
    },
    "evidenceRows": [
      {
        "field": "mechanism",
        "label": "可能機轉"
      },
      {
        "field": "certainty",
        "label": "機轉確定程度"
      },
      {
        "field": "acute_rom",
        "label": "對短期活動度"
      },
      {
        "field": "chronic_rom",
        "label": "對長期活動度"
      },
      {
        "field": "pain_effect",
        "label": "對疼痛或痠痛"
      },
      {
        "field": "performance",
        "label": "對肌力與運動表現"
      },
      {
        "field": "summary",
        "label": "摘要"
      },
      {
        "field": "red_flags",
        "label": "不適合自行練習的情況",
        "type": "flags"
      },
      {
        "field": "caveats",
        "label": "必須誠實告知的限制"
      }
    ],
    "problemType": "practice",
    "facetClear": "清除區域篩選",
    "facetPrefix": "區域",
    "emptyTitle": "找不到符合的內容",
    "emptyHint": "換個關鍵字或清除區域篩選再試一次。",
    "playlistSearch": "搜尋播放清單…",
    "prevLabel": "上一部影片",
    "nextLabel": "下一部影片",
    "doneLabel": "完成",
    "openExternal": "在 YouTube 開啟",
    "moreLabel": "選片理由與自我檢核",
    "discussLabel": "討論",
    "discussNote": "留言會同步到 GitHub Discussions，需要 GitHub 帳號才能發言。每支影片各有一串討論。",
    "filterAll": "全部",
    "lessonNoun": "堂主課",
    "drillNoun": "支示範影片",
    "tierLabel": "來源分級",
    "scopeNoteLabel": "課程補充"
  },
  "kinds": [
    {
      "id": "assess",
      "label": "自我評估",
      "tone": "attention"
    },
    {
      "id": "release",
      "label": "放鬆／自我按摩",
      "tone": "accent"
    },
    {
      "id": "move",
      "label": "主動活動",
      "tone": "success"
    },
    {
      "id": "load",
      "label": "負荷整合",
      "tone": "danger"
    }
  ],
  "grades": [
    {
      "id": "strong",
      "label": "證據較充分",
      "tone": "success"
    },
    {
      "id": "moderate",
      "label": "證據中等",
      "tone": "accent"
    },
    {
      "id": "limited",
      "label": "證據有限",
      "tone": "attention"
    },
    {
      "id": "expert-consensus",
      "label": "專家共識",
      "tone": "done"
    },
    {
      "id": "experience",
      "label": "經驗性主張",
      "tone": "neutral"
    },
    {
      "id": "contested",
      "label": "存在爭議",
      "tone": "danger"
    }
  ],
  "values": [
    {
      "id": "very-high",
      "label": "非常高",
      "tone": "success"
    },
    {
      "id": "high",
      "label": "高",
      "tone": "accent"
    },
    {
      "id": "medium",
      "label": "中等",
      "tone": "neutral"
    },
    {
      "id": "limited",
      "label": "有限",
      "tone": "attention"
    }
  ],
  "roles": [
    {
      "id": "science",
      "label": "科學基礎",
      "tone": "accent"
    },
    {
      "id": "expert-view",
      "label": "專家觀點",
      "tone": "accent"
    },
    {
      "id": "coach",
      "label": "教練經驗",
      "tone": "success"
    },
    {
      "id": "clinical",
      "label": "臨床經驗",
      "tone": "success"
    },
    {
      "id": "demo",
      "label": "動作示範",
      "tone": "neutral"
    },
    {
      "id": "program",
      "label": "課表設計",
      "tone": "neutral"
    },
    {
      "id": "contested-view",
      "label": "爭議觀點",
      "tone": "danger"
    },
    {
      "id": "safety",
      "label": "安全提醒",
      "tone": "attention"
    }
  ],
  "languages": {
    "zh": "繁中",
    "en": "English"
  },
  "taxonomy": {
    "facets": "taxonomy.regions",
    "categories": "taxonomy.methods"
  },
  "nav": [
    {
      "title": "基礎",
      "chapters": [
        "CH0",
        "CH1",
        "CH2"
      ]
    },
    {
      "title": "十二條經線",
      "chapters": [
        "CH3",
        "CH4",
        "CH5",
        "CH6",
        "CH7",
        "CH8",
        "CH9"
      ]
    },
    {
      "title": "方法與整合",
      "chapters": [
        "CH10",
        "CH11",
        "CH12"
      ]
    }
  ],
  "chapters": [
    {
      "code": "CH0",
      "title": "課程使用方式與安全界線",
      "icon": "book-open",
      "source": "ch0",
      "units": 1,
      "drills": 0
    },
    {
      "code": "CH1",
      "title": "什麼是筋膜與筋膜系統",
      "icon": "layers",
      "source": "ch1-2",
      "units": 4,
      "drills": 0
    },
    {
      "code": "CH2",
      "title": "經線的讀法與這套框架的驗證狀態",
      "icon": "microscope",
      "source": "ch1-2",
      "units": 4,
      "drills": 0
    },
    {
      "code": "CH3",
      "title": "淺背線 Superficial Back Line",
      "icon": "move-down",
      "source": "line-sbl",
      "units": 3,
      "drills": 18
    },
    {
      "code": "CH4",
      "title": "淺前線 Superficial Front Line",
      "icon": "move-up",
      "source": "line-sfl",
      "units": 3,
      "drills": 18
    },
    {
      "code": "CH5",
      "title": "側線 Lateral Line",
      "icon": "move-diagonal",
      "source": "line-ll",
      "units": 3,
      "drills": 18
    },
    {
      "code": "CH6",
      "title": "螺旋線 Spiral Line",
      "icon": "rotate-ccw",
      "source": "line-sl",
      "units": 3,
      "drills": 18
    },
    {
      "code": "CH7",
      "title": "手臂線 Arm Lines",
      "icon": "move-vertical",
      "source": "line-al",
      "units": 4,
      "drills": 20
    },
    {
      "code": "CH8",
      "title": "功能線 Functional Lines",
      "icon": "link",
      "source": "line-fl",
      "units": 3,
      "drills": 15
    },
    {
      "code": "CH9",
      "title": "深前線 Deep Front Line",
      "icon": "wind",
      "source": "line-dfl",
      "units": 3,
      "drills": 18
    },
    {
      "code": "CH10",
      "title": "自我放鬆與工具使用",
      "icon": "waves",
      "source": "ch10",
      "units": 4,
      "drills": 24
    },
    {
      "code": "CH11",
      "title": "活動度、負荷與彈性回彈",
      "icon": "accessibility",
      "source": "ch11",
      "units": 4,
      "drills": 24
    },
    {
      "code": "CH12",
      "title": "課表整合",
      "icon": "clipboard-list",
      "source": "ch12",
      "units": 1,
      "drills": 6
    }
  ],
  "audit": {
    "duration": {
      "lesson": {
        "min": "3:00",
        "max": "30:00"
      },
      "drill": {
        "min": "0:30",
        "max": "14:00"
      }
    },
    "driftSeconds": 30,
    "minViews": 3000,
    "metaCoverage": 1,
    "drillsPerUnit": {
      "min": 5,
      "max": 8
    },
    "maxSharedVideos": 20,
    "requireAssessment": [
      "practice",
      "myth"
    ],
    "minAssessmentChars": 80,
    "minCitations": 2,
    "allowMissingUrls": 4,
    "roleCoverage": 1,
    "contentMix": {
      "science+expert-view": 0.2,
      "coach+clinical": 0.4,
      "demo": 0.3,
      "contested-view": 0.1
    },
    "contentMixTolerance": 0.1,
    "tierCoverage": 1
  },
  "evidenceAlias": {
    "ch2-u1": "concept-1",
    "ch2-u3": "concept-2",
    "ch2-u4": "concept-3"
  },
  "stance": {
    "title": "這門課的立場",
    "intro": "筋膜是這幾年最好賣的兩個字。開始練之前，我們先把三個最根本的問題丟給文獻查證：滾筒真的能把沾黏「壓開」嗎？解剖學上真的存在一條一條的筋膜鏈嗎？姿勢不良真的會導致疼痛嗎？答案沒有工作坊裡講得那麼篤定——但把它講清楚，比賣一個承諾誠實得多。以下每一條結論都附原始文獻連結，你可以自己去查。",
    "verdicts": {
      "concept-1": "滾筒確實能在當下增加關節活動度，但把效果歸因於「壓開沾黏」缺乏證據——影響範圍常常跨到沒滾到的對側肢體，這比較像是神經系統的疼痛耐受度改變。",
      "concept-2": "筋膜鏈的解剖連續性只有部分被大體研究支持，而「拉這裡會影響那裡」的力量傳遞在活體上的實際幅度遠小於工作坊的圖片所暗示。",
      "concept-3": "姿勢與疼痛的關聯在大型族群研究中一再落空——把疼痛歸咎於某個角度，往往是把相關當成因果。"
    },
    "outroTitle": "所以這門課的定位是什麼？",
    "outro": "自我筋膜放鬆與伸展是<strong>低成本、低風險、效果短暫</strong>的介入：它能讓你當下動得開一點、痛得少一點，然後你要拿這個窗口去做真正產生長期適應的事——<strong>在可控範圍內主動使用那個活動度，並漸進地增加負荷</strong>。滾筒不是治療，是暖身與自我照顧；把它當成療程會失望，把它當成訓練前後的工具則相當划算。真正需要診斷的疼痛、麻木、無力或外傷，請去看醫師或物理治療師，不要用滾筒處理。"
  },
  "landing": {
    "howTitle": "怎麼用這門課",
    "steps": [
      {
        "icon": "clipboard-check",
        "title": "先自我評估",